[
  {
    "id": "denaback_20140101",
    "path": "highlights/site_photos/denaback_20140101.webp",
    "site_key": "DENABACK",
    "park_code": "DENA",
    "site_code": "BACK",
    "taken_date": "2014-01-01",
    "source_filename": "denaback_20140101.webp"
  },
  {
    "id": "denaback_20140724",
    "path": "highlights/site_photos/denaback_20140724.webp",
    "site_key": "DENABACK",
    "park_code": "DENA",
    "site_code": "BACK",
    "taken_date": "2014-07-24",
    "source_filename": "denaback_20140724.webp"
  },
  {
    "id": "denabicr_20130101",
    "path": "highlights/site_photos/denabicr_20130101.webp",
    "site_key": "DENABICR",
    "park_code": "DENA",
    "site_code": "BICR",
    "taken_date": "2013-01-01",
    "source_filename": "denabicr_20130101.webp"
  },
  {
    "id": "denabicr_20130809",
    "path": "highlights/site_photos/denabicr_20130809.webp",
    "site_key": "DENABICR",
    "park_code": "DENA",
    "site_code": "BICR",
    "taken_date": "2013-08-09",
    "source_filename": "denabicr_20130809.webp"
  },
  {
    "id": "denabmul_20210101",
    "path": "highlights/site_photos/denabmul_20210101.webp",
    "site_key": "DENABMUL",
    "park_code": "DENA",
    "site_code": "BMUL",
    "taken_date": "2021-01-01",
    "source_filename": "denabmul_20210101.webp"
  },
  {
    "id": "denabmul_20210401",
    "path": "highlights/site_photos/denabmul_20210401.webp",
    "site_key": "DENABMUL",
    "park_code": "DENA",
    "site_code": "BMUL",
    "taken_date": "2021-04-01",
    "source_filename": "denabmul_20210401.webp"
  },
  {
    "id": "denacabn_20130101",
    "path": "highlights/site_photos/denacabn_20130101.webp",
    "site_key": "DENACABN",
    "park_code": "DENA",
    "site_code": "CABN",
    "taken_date": "2013-01-01",
    "source_filename": "denacabn_20130101.webp"
  },
  {
    "id": "denacath_20120101",
    "path": "highlights/site_photos/denacath_20120101.webp",
    "site_key": "DENACATH",
    "park_code": "DENA",
    "site_code": "CATH",
    "taken_date": "2012-01-01",
    "source_filename": "denacath_20120101.webp"
  },
  {
    "id": "denacath_20170101",
    "path": "highlights/site_photos/denacath_20170101.webp",
    "site_key": "DENACATH",
    "park_code": "DENA",
    "site_code": "CATH",
    "taken_date": "2017-01-01",
    "source_filename": "denacath_20170101.webp"
  },
  {
    "id": "denafang_20110101",
    "path": "highlights/site_photos/denafang_20110101.webp",
    "site_key": "DENAFANG",
    "park_code": "DENA",
    "site_code": "FANG",
    "taken_date": "2011-01-01",
    "source_filename": "denafang_20110101.webp"
  },
  {
    "id": "denafang_20110708",
    "path": "highlights/site_photos/denafang_20110708.webp",
    "site_key": "DENAFANG",
    "park_code": "DENA",
    "site_code": "FANG",
    "taken_date": "2011-07-08",
    "source_filename": "denafang_20110708.webp"
  },
  {
    "id": "denafang_20130101",
    "path": "highlights/site_photos/denafang_20130101.webp",
    "site_key": "DENAFANG",
    "park_code": "DENA",
    "site_code": "FANG",
    "taken_date": "2013-01-01",
    "source_filename": "denafang_20130101.webp"
  },
  {
    "id": "denahauk_20140101",
    "path": "highlights/site_photos/denahauk_20140101.webp",
    "site_key": "DENAHAUK",
    "park_code": "DENA",
    "site_code": "HAUK",
    "taken_date": "2014-01-01",
    "source_filename": "denahauk_20140101.webp"
  },
  {
    "id": "denahauk_20140607",
    "path": "highlights/site_photos/denahauk_20140607.webp",
    "site_key": "DENAHAUK",
    "park_code": "DENA",
    "site_code": "HAUK",
    "taken_date": "2014-06-07",
    "source_filename": "denahauk_20140607.webp"
  },
  {
    "id": "denahauk_20140617",
    "path": "highlights/site_photos/denahauk_20140617.webp",
    "site_key": "DENAHAUK",
    "park_code": "DENA",
    "site_code": "HAUK",
    "taken_date": "2014-06-17",
    "source_filename": "denahauk_20140617.webp"
  },
  {
    "id": "denahig1_20120101",
    "path": "highlights/site_photos/denahig1_20120101.webp",
    "site_key": "DENAHIG1",
    "park_code": "DENA",
    "site_code": "HIG1",
    "taken_date": "2012-01-01",
    "source_filename": "denahig1_20120101.webp"
  },
  {
    "id": "denahig1_20120802",
    "path": "highlights/site_photos/denahig1_20120802.webp",
    "site_key": "DENAHIG1",
    "park_code": "DENA",
    "site_code": "HIG1",
    "taken_date": "2012-08-02",
    "source_filename": "denahig1_20120802.webp"
  },
  {
    "id": "denahog3_20120101",
    "path": "highlights/site_photos/denahog3_20120101.webp",
    "site_key": "DENAHOG3",
    "park_code": "DENA",
    "site_code": "HOG3",
    "taken_date": "2012-01-01",
    "source_filename": "denahog3_20120101.webp"
  },
  {
    "id": "denahog3_20120605",
    "path": "highlights/site_photos/denahog3_20120605.webp",
    "site_key": "DENAHOG3",
    "park_code": "DENA",
    "site_code": "HOG3",
    "taken_date": "2012-06-05",
    "source_filename": "denahog3_20120605.webp"
  },
  {
    "id": "denahots_20140101",
    "path": "highlights/site_photos/denahots_20140101.webp",
    "site_key": "DENAHOTS",
    "park_code": "DENA",
    "site_code": "HOTS",
    "taken_date": "2014-01-01",
    "source_filename": "denahots_20140101.webp"
  },
  {
    "id": "denahots_20140602",
    "path": "highlights/site_photos/denahots_20140602.webp",
    "site_key": "DENAHOTS",
    "park_code": "DENA",
    "site_code": "HOTS",
    "taken_date": "2014-06-02",
    "source_filename": "denahots_20140602.webp"
  },
  {
    "id": "denakich_20120101",
    "path": "highlights/site_photos/denakich_20120101.webp",
    "site_key": "DENAKICH",
    "park_code": "DENA",
    "site_code": "KICH",
    "taken_date": "2012-01-01",
    "source_filename": "denakich_20120101.webp"
  },
  {
    "id": "denakich_20120522",
    "path": "highlights/site_photos/denakich_20120522.webp",
    "site_key": "DENAKICH",
    "park_code": "DENA",
    "site_code": "KICH",
    "taken_date": "2012-05-22",
    "source_filename": "denakich_20120522.webp"
  },
  {
    "id": "denakich_20120524",
    "path": "highlights/site_photos/denakich_20120524.webp",
    "site_key": "DENAKICH",
    "park_code": "DENA",
    "site_code": "KICH",
    "taken_date": "2012-05-24",
    "source_filename": "denakich_20120524.webp"
  },
  {
    "id": "denamoos_20180101",
    "path": "highlights/site_photos/denamoos_20180101.webp",
    "site_key": "DENAMOOS",
    "park_code": "DENA",
    "site_code": "MOOS",
    "taken_date": "2018-01-01",
    "source_filename": "denamoos_20180101.webp"
  },
  {
    "id": "denamoos_20180814",
    "path": "highlights/site_photos/denamoos_20180814.webp",
    "site_key": "DENAMOOS",
    "park_code": "DENA",
    "site_code": "MOOS",
    "taken_date": "2018-08-14",
    "source_filename": "denamoos_20180814.webp"
  },
  {
    "id": "denamuri_20150101",
    "path": "highlights/site_photos/denamuri_20150101.webp",
    "site_key": "DENAMURI",
    "park_code": "DENA",
    "site_code": "MURI",
    "taken_date": "2015-01-01",
    "source_filename": "denamuri_20150101.webp"
  },
  {
    "id": "denamuri_20150519",
    "path": "highlights/site_photos/denamuri_20150519.webp",
    "site_key": "DENAMURI",
    "park_code": "DENA",
    "site_code": "MURI",
    "taken_date": "2015-05-19",
    "source_filename": "denamuri_20150519.webp"
  },
  {
    "id": "denamuri_20150523",
    "path": "highlights/site_photos/denamuri_20150523.webp",
    "site_key": "DENAMURI",
    "park_code": "DENA",
    "site_code": "MURI",
    "taken_date": "2015-05-23",
    "source_filename": "denamuri_20150523.webp"
  },
  {
    "id": "denamuri_20150526",
    "path": "highlights/site_photos/denamuri_20150526.webp",
    "site_key": "DENAMURI",
    "park_code": "DENA",
    "site_code": "MURI",
    "taken_date": "2015-05-26",
    "source_filename": "denamuri_20150526.webp"
  },
  {
    "id": "denapol2_20120101",
    "path": "highlights/site_photos/denapol2_20120101.webp",
    "site_key": "DENAPOL2",
    "park_code": "DENA",
    "site_code": "POL2",
    "taken_date": "2012-01-01",
    "source_filename": "denapol2_20120101.webp"
  },
  {
    "id": "denarugl_20170101",
    "path": "highlights/site_photos/denarugl_20170101.webp",
    "site_key": "DENARUGL",
    "park_code": "DENA",
    "site_code": "RUGL",
    "taken_date": "2017-01-01",
    "source_filename": "denarugl_20170101.webp"
  },
  {
    "id": "denaruth_20190101",
    "path": "highlights/site_photos/denaruth_20190101.webp",
    "site_key": "DENARUTH",
    "park_code": "DENA",
    "site_code": "RUTH",
    "taken_date": "2019-01-01",
    "source_filename": "denaruth_20190101.webp"
  },
  {
    "id": "denaruth_20190529",
    "path": "highlights/site_photos/denaruth_20190529.webp",
    "site_key": "DENARUTH",
    "park_code": "DENA",
    "site_code": "RUTH",
    "taken_date": "2019-05-29",
    "source_filename": "denaruth_20190529.webp"
  },
  {
    "id": "denasan3_20120101",
    "path": "highlights/site_photos/denasan3_20120101.webp",
    "site_key": "DENASAN3",
    "park_code": "DENA",
    "site_code": "SAN3",
    "taken_date": "2012-01-01",
    "source_filename": "denasan3_20120101.webp"
  },
  {
    "id": "denaskgl_20210101",
    "path": "highlights/site_photos/denaskgl_20210101.webp",
    "site_key": "DENASKGL",
    "park_code": "DENA",
    "site_code": "SKGL",
    "taken_date": "2021-01-01",
    "source_filename": "denaskgl_20210101.webp"
  },
  {
    "id": "denasush_20260101",
    "path": "highlights/site_photos/denasush_20260101.webp",
    "site_key": "DENASUSH",
    "park_code": "DENA",
    "site_code": "SUSH",
    "taken_date": "2026-01-01",
    "source_filename": "denasush_20260101.webp"
  },
  {
    "id": "denasush_20260612",
    "path": "highlights/site_photos/denasush_20260612.webp",
    "site_key": "DENASUSH",
    "park_code": "DENA",
    "site_code": "SUSH",
    "taken_date": "2026-06-12",
    "source_filename": "denasush_20260612.webp"
  },
  {
    "id": "denathri_20150101",
    "path": "highlights/site_photos/denathri_20150101.webp",
    "site_key": "DENATHRI",
    "park_code": "DENA",